{
  "schema_id": "stratai.support_anchor_protocol@1",
  "contract_version": "1.0.0-candidate.1",
  "scope": "factual_support_research_only",
  "capability_reference": "CAP-TEAM-001",
  "decision_id": null,
  "selection": "sampled_pair_separation_increase_onset",
  "unit": "directed_actor_ally_instance",
  "history_samples": 3,
  "nominal_sample_hz": 16,
  "history_rule": "same_instance_epoch_lives_side_connected_alive_playing_exact_sample_steps",
  "selection_equation": "d2_previous <= d2_before_previous AND d2_current > d2_previous",
  "threshold_semantics": "zero_sign_change_of_quantized_observed_distance_not_tactical_threshold",
  "t0": "current_FrameDone_sample_after_observed_increase_not_before_physical_entry",
  "deduplication": "one_onset_per_directed_pair_and_source_sequence_no_retrigger_during_continuous_increase",
  "future_window_seconds": 2,
  "future_rule": "exact_horizon_sample_and_complete_same_life_playing_cadence_otherwise_unavailable",
  "legal_features": "self_and_selected_ally_positions_alive_from_three_prefix_samples_only",
  "future_and_oracle_used_for_selection": false,
  "physical_entry_accredited": false,
  "comparison_allowed": false,
  "training_allowed": false,
  "product_supported": false
}
